{
  "$ref": "#/definitions/source",
  "definitions": {
    "source": {
      "type": "object",
      "properties": {
        "id": {
          "type": "string",
          "minLength": 1
        },
        "tier": {
          "type": "number",
          "enum": [
            1,
            2,
            3
          ]
        },
        "publisher": {
          "type": "string",
          "minLength": 1
        },
        "title": {
          "type": "string",
          "minLength": 1
        },
        "url": {
          "type": "string",
          "format": "uri"
        },
        "stable_ref": {
          "type": "string"
        },
        "pub_date": {
          "type": "string",
          "pattern": "^\\d{4}-\\d{2}-\\d{2}$"
        },
        "version_date": {
          "type": "string",
          "pattern": "^\\d{4}-\\d{2}-\\d{2}$"
        },
        "language": {
          "type": "string",
          "minLength": 1
        },
        "is_translation": {
          "type": "boolean",
          "default": false
        },
        "translation_of": {
          "type": "string"
        },
        "archived_url": {
          "type": "string",
          "format": "uri"
        },
        "accessed_date": {
          "type": "string",
          "pattern": "^\\d{4}-\\d{2}-\\d{2}$"
        },
        "manual_verification_date": {
          "type": "string",
          "pattern": "^\\d{4}-\\d{2}-\\d{2}$"
        },
        "fixture": {
          "type": "boolean"
        }
      },
      "required": [
        "id",
        "tier",
        "publisher",
        "title",
        "url",
        "language",
        "accessed_date"
      ],
      "additionalProperties": false
    }
  },
  "$schema": "http://json-schema.org/draft-07/schema#",
  "$id": "atlas/source",
  "$comment": "GENERATED from src/lib/schemas (Zod is normative — ENG §8/MN-15). Do not edit by hand."
}
