[
  {
    "id": "eu-src-aiact-eurlex",
    "tier": 1,
    "publisher": "EUR-Lex (Official Journal of the European Union)",
    "title": "Regulation (EU) 2024/1689 (Artificial Intelligence Act)",
    "url": "https://eur-lex.europa.eu/legal-content/EN/TXT/?uri=CELEX:32024R1689",
    "stable_ref": "CELEX:32024R1689 · OJ L, 2024/1689, 12.7.2024",
    "pub_date": "2024-07-12",
    "language": "en",
    "is_translation": false,
    "accessed_date": "2026-07-12",
    "manual_verification_date": "2026-07-12"
  },
  {
    "id": "eu-src-aiact-servicedesk",
    "tier": 2,
    "publisher": "European Commission — AI Act Service Desk",
    "title": "AI Act article texts (official Commission information platform)",
    "url": "https://ai-act-service-desk.ec.europa.eu/en/ai-act",
    "pub_date": "2025-10-08",
    "language": "en",
    "is_translation": false,
    "accessed_date": "2026-07-12",
    "manual_verification_date": "2026-07-12"
  },
  {
    "id": "eu-src-omnibus-consilium",
    "tier": 2,
    "publisher": "Council of the European Union (Consilium press office)",
    "title": "Artificial intelligence: Council gives final green light to simplify and streamline rules",
    "url": "https://www.consilium.europa.eu/en/press/press-releases/2026/06/29/artificial-intelligence-council-gives-final-green-light-to-simplify-and-streamline-rules/",
    "pub_date": "2026-06-29",
    "language": "en",
    "is_translation": false,
    "accessed_date": "2026-07-12"
  },
  {
    "id": "eu-src-gdpr-eurlex",
    "tier": 1,
    "publisher": "EUR-Lex (Official Journal of the European Union)",
    "title": "Regulation (EU) 2016/679 (General Data Protection Regulation)",
    "url": "https://eur-lex.europa.eu/legal-content/EN/TXT/?uri=CELEX:32016R0679",
    "stable_ref": "CELEX:32016R0679 · OJ L 119, 4.5.2016",
    "pub_date": "2016-05-04",
    "language": "en",
    "is_translation": false,
    "accessed_date": "2026-07-12",
    "manual_verification_date": "2026-07-12"
  },
  {
    "id": "us-src-sb24205-leg",
    "tier": 1,
    "publisher": "Colorado General Assembly",
    "title": "SB24-205 Consumer Protections for Artificial Intelligence (bill page)",
    "url": "https://leg.colorado.gov/bills/sb24-205",
    "stable_ref": "SB24-205 (Colo. 2024)",
    "pub_date": "2024-05-17",
    "language": "en",
    "is_translation": false,
    "accessed_date": "2026-07-12",
    "manual_verification_date": "2026-07-12"
  },
  {
    "id": "us-src-sb26189-leg",
    "tier": 1,
    "publisher": "Colorado General Assembly",
    "title": "SB26-189 Automated Decision-Making Technology (bill page)",
    "url": "https://leg.colorado.gov/bills/sb26-189",
    "stable_ref": "SB26-189 (Colo. 2026)",
    "pub_date": "2026-05-14",
    "language": "en",
    "is_translation": false,
    "accessed_date": "2026-07-12",
    "manual_verification_date": "2026-07-12"
  },
  {
    "id": "cn-src-labeling-cac",
    "tier": 1,
    "publisher": "国家互联网信息办公室 (Cyberspace Administration of China) — cac.gov.cn",
    "title": "关于印发《人工智能生成合成内容标识办法》的通知 (Measures for Labeling AI-Generated Synthetic Content)",
    "url": "https://www.cac.gov.cn/2025-03/14/c_1743654684782215.htm",
    "stable_ref": "国信办通字〔2025〕2号",
    "pub_date": "2025-03-07",
    "language": "zh",
    "is_translation": false,
    "accessed_date": "2026-07-12",
    "manual_verification_date": "2026-07-12"
  },
  {
    "id": "sg-src-mgf-genai",
    "tier": 1,
    "publisher": "AI Verify Foundation & Infocomm Media Development Authority (IMDA)",
    "title": "Model AI Governance Framework for Generative AI — Fostering a Trusted Ecosystem",
    "url": "https://aiverifyfoundation.sg/wp-content/uploads/2024/05/Model-AI-Governance-Framework-for-Generative-AI-May-2024-1-1.pdf",
    "stable_ref": "MGF-GenAI (May 2024)",
    "pub_date": "2024-05-30",
    "language": "en",
    "is_translation": false,
    "accessed_date": "2026-07-12",
    "manual_verification_date": "2026-07-12"
  },
  {
    "id": "us-src-eo14179-govinfo",
    "tier": 1,
    "publisher": "U.S. Government Publishing Office (govinfo.gov) — Federal Register",
    "title": "Executive Order 14179 — Removing Barriers to American Leadership in Artificial Intelligence",
    "url": "https://www.govinfo.gov/content/pkg/FR-2025-01-31/pdf/2025-02172.pdf",
    "stable_ref": "90 FR 8741 · FR Doc. 2025-02172",
    "pub_date": "2025-01-31",
    "language": "en",
    "is_translation": false,
    "accessed_date": "2026-07-12",
    "manual_verification_date": "2026-07-12"
  },
  {
    "id": "us-src-eo14148-govinfo",
    "tier": 1,
    "publisher": "U.S. Government Publishing Office (govinfo.gov) — Federal Register",
    "title": "Executive Order 14148 — Initial Rescissions of Harmful Executive Orders and Actions",
    "url": "https://www.govinfo.gov/content/pkg/FR-2025-01-28/pdf/2025-01901.pdf",
    "stable_ref": "90 FR 8237 · FR Doc. 2025-01901",
    "pub_date": "2025-01-28",
    "language": "en",
    "is_translation": false,
    "accessed_date": "2026-07-12",
    "manual_verification_date": "2026-07-12"
  },
  {
    "id": "cn-src-genai-interim-cac",
    "tier": 1,
    "publisher": "国家互联网信息办公室 (CAC) — cac.gov.cn",
    "title": "生成式人工智能服务管理暂行办法 (Interim Measures for the Management of Generative AI Services)",
    "url": "https://www.cac.gov.cn/2023-07/13/c_1690898327029107.htm",
    "stable_ref": "国家互联网信息办公室令第15号",
    "pub_date": "2023-07-10",
    "language": "zh",
    "is_translation": false,
    "accessed_date": "2026-07-12",
    "manual_verification_date": "2026-07-12"
  },
  {
    "id": "cn-src-deepsynthesis-cac",
    "tier": 1,
    "publisher": "国家互联网信息办公室 (CAC) — cac.gov.cn",
    "title": "互联网信息服务深度合成管理规定 (Provisions on the Administration of Deep Synthesis of Internet Information Services)",
    "url": "https://www.cac.gov.cn/2022-12/11/c_1672221949318230.htm",
    "stable_ref": "三部门规定 (2022-12-11 公布; 文号未见于发布页 — Pass 2 补录)",
    "pub_date": "2022-12-11",
    "language": "zh",
    "is_translation": false,
    "accessed_date": "2026-07-12",
    "manual_verification_date": "2026-07-12"
  },
  {
    "id": "cn-src-algo-rec-cac",
    "tier": 1,
    "publisher": "国家互联网信息办公室 (CAC) — cac.gov.cn",
    "title": "互联网信息服务算法推荐管理规定 (Provisions on the Administration of Algorithmic Recommendation of Internet Information Services)",
    "url": "https://www.cac.gov.cn/2022-01/04/c_1642894606364259.htm",
    "stable_ref": "四部门令第9号",
    "pub_date": "2021-12-31",
    "language": "zh",
    "is_translation": false,
    "accessed_date": "2026-07-12",
    "manual_verification_date": "2026-07-12"
  }
]